,app_id,Topic,Label,Sublabel,,
231,775,2,Game,Graphic Intensive,Killing Floor Series,KF2: Activation key must be used on a valid Steam account. Requires internet connection. Content Pack Update March 2017 New Map: The Descent: An all new type of KF2 map that has a series of random battle locations as players descend to a new random location each wave. This map really shakes up KF2's gameplay. New Map: Nuked: This is a community made map that we have made official. It has been through internal QA along with a lot of polish that will only be seen in the updated version. New Weapon: Flare Revolvers a favorite from KF1 these are single and dual flare gun revolvers for the firebug perk. New Weapon: Stoner 63a LMG an all new weapon type in KF2 this gun is a light machine gun that has really long sustained fire. A trophy update on PSN that also contains trophies for the map released in January and the new maps released in this update. Tropical Bash Update: New Map : Zed Landing - A plane crash on a tropical volcano island with dynamic volcano effects New Zed: Gordien - a tougher higher level gore fast with 2 blades New Emotes: New emote animations players can trigger during game-play one comes for free others are gained from unlocking emote crates New Weapon: The Bone Crusher - A devastating makeshift shield and mace Berserker melee weapon New Feature: Dual Perk Weapons - Weapons can now belong to more than one perk greatly increasing weapon choices for each perk About the game In KILLING FLOOR 2 players descend into continental Europe where the outbreak caused by Horzine Biotech  failed experiment has quickly spread and gained unstoppable momentum essentially paralyzing the European Union  Just one month after the conclusion of the events in the original KILLING FLOOR the specimen clones are everywhere and civilization is in disarray; communications have failed governments have collapsed and military forces have been systematically eradicated. The people of Europe know survival and self-preservation too well and lucky survivors have gone into hiding. Not all have given up hope though... A group of civilians and mercenaries have banded together to combat the outbreak and established privately funded operation bases across Europe. Upon tracking specimen clone outbreaks players will descend into zed-laden hot zones and exterminate them. Key Features Visceral Gore - KILLING FLOOR 2 ramps up the gore with a proprietary high powered persistent blood system bringing new levels of fidelity to the genre. Players will send entrails severed limbs and blood flying as they wade through hordes of enemies. But they need to watch out! If caught enemies will rip them and their entire party limb from limb 6 player co-op or solo play - A multitude of varied playable characters await for players to choose from as they enter the fray in online co-op mode or solo mode for those willing to brave the horrific specimens alone Versus Survival Game Mode - Be the Zed! A 12 player PvP mode where two teams take turns playing Humans vs. Zeds in a pair of short matches. In the first match one team plays Humans and the other Zeds until the humans all die during a single round or they beat the boss. For the second match the teams switch sides and when the battle is completed both teams receive a score based on their performance and the higher score wins! Terrifying Zeds - New enemies and fan favorites from the original game are back with expanded and smarter artificial intelligence dishing out powerful attacks working as a group to weaken the player  party and pushing the challenge level and fear factor to new levels Unique Blend Of Weaponry - From modern militaristic assault rifles brutal improvised makeshift weapons classic historical guns and off the wall  Mad Scientist  weapons KILLING FLOOR 2 has a unique blend of killing tools that will satisfy any gamer Expanded Perk System - Perks from the original game have been reimagined with more added to the fold. All perks now progress with meaningful talent choices that amplify different play styles giving players a progression path that is expansive and full of rewarding milestones Brutal Melee Combat - KILLING FLOOR 2 reinvents melee combat completely. Players now have control over the type of melee attacks they can perform enabling them to deliver bone-breaking crippling attacks to Zeds System Requirements Windows - Minimum OS: Win7 64-bit Win8/8.1 64-bit Processor: Core 2 Duo E8200 2.66GHz or Phenom II X2 545 Memory: 3 GB RAM Graphics: GeForce GTS 250 or Radeon HD 4830 DirectX: Version 10 Network: Broadband Internet connection Storage: 20 GB available space Additional Notes: UNSUPPORTED HARDWARE: IntelHD Integrated Graphics Chips 32-bit Operating Systems NVIDIA  FleX features require a GeForce  GTX  770 or higher (GeForce  GTX  980 recommended) Windows - Recommended OS: Windows 10 64-bit Processor: Core 2 Quad Q9550 2.83GHz or Phenom II X4 955 Memory: 4 GB RAM Graphics: GeForce GTX 560 or Radeon HD 6950 DirectX: Version 11 Network: Broadband Internet connection Storage: 50 GB available space Additional Notes: For more assistance click Here NVIDIA  FleX features require a GeForce  GTX  770 or higher (GeForce  GTX  980 recommended)
264,800,2,Game,Graphic Intensive,Magicka 2,"NOTICE: Activation key must be used on a valid Steam account THE GAME The world's most irreverent co-op action adventure returns! In the next chapter of Magicka players ascend from the ruins of Aldrheim to experience a Midgrd almost wiped free of Wizards after the Wizard Wars with the few that do remain having either gone mad or extremely hostile toward all others. To rid the world of evil again up to four Wizards and their guide Vlad will traverse Midgrd armed with the next iteration of the famous Magicka dynamic spellcasting system as players reprise their roles as the most overpowered unpredictably funny Wizards ever known to fantasy! KEY FEATURES Learn to Spell Again As an all-powerful Wizard you will have thousands of spells at your fingertips to experiment and defeat evil with use them together with special Magicks to annihilate foes or give necessary aid to your companions. Combine up to five elements at a time and work together with  or against  your friends for that full Magicka co-op experience. Four Player Friendly Fire Compatible Co-op Full co-op support! All levels and game modes in Magicka 2 will be supported for four player co-op with hot join checkpoints and other supportive features and functionality. Friendly fire is always on promoting emergent gameplay humor as players accidentally hurt or kill their friends in their attempts to annihilate enemies. Overcome insurmountable odds to beat the Challenge mode. Be the Wizard You Want to Be With tons of robes staffs and weapons you can play as the robed Wizard of your choice to wreak havoc amongst hordes of fantasy creatures as you see fit. Magicka 2's dynamic spellcasting system can be used in many different ways offering hours of experimentation for players to figure out which spells belong in their repertoire. Add both co-op and friendly fire on top of that and you have a recipe for hilarious disasters. Replay the Next Chapter with Artifacts Magicka 2 offers players a story-driven campaign mode set in a lush fantasy world influenced heavily by Nordic folklore. New to the franchise are Artifacts which act as different switches and options for players to customize and change the gameplay experience adding more replayability when utilized. SYSTEM REQUIREMENTS Windows Minimum: OS: Windows 7 or Windows 8 Processor: 3GHz Dual Core (Intel Pentium G3220 or higher / AMD A4-4000 or higher) Memory: 2 GB Graphics: Nvidia GeForce 550 or better / ATI Radeon HD 5850 or better Hard Drive: 3 GB available space Sound: DirectX Compatible Sound Card Recommended: OS: Windows 7 or Windows 8 Processor: 2.8GHz Quad Core (Intel Core i5-2300 or higher / AMD A8-3850 or higher) Memory: 4 GB Graphics: Nvidia GeForce 640 or better / ATI Radeon HD 6670 or better Hard Drive: 3 GB available space Sound: DirectX Compatible Sound Card Mac OS Minimum: OS: OSX 10.7 Processor: Intel Core i5 1.7GHz Dual-Core Memory: 4 GB RAM Graphics: Intel HD Graphics 4000 Hard Drive: 3 GB available space Recommended: OS: OSX 10.7 Processor: Intel Core i5 2.5GHz Memory: 4 GB RAM Graphics: Radeon HD 6750M Hard Drive: 3 GB available space Linux Minimum: OS: Ubuntu 12.04 Processor: Processor: CPU: 3GHz Dual Core (Intel Pentium G3220 or higher / AMD A4-4000 or higher) Memory: 2 GB RAM Graphics: Graphics: Nvidia GeForce 550 or better / ATI Radeon HD 5850 or better Recommended: OS: Ubuntu 14.04 LTS Processor: Processor: 2.8GHz Quad Core (Intel Core i5-2300 or higher / AMD A8-3850 or higher) Memory: 4 GB RAM Graphics: Graphics: Nvidia GeForce 640 or better / ATI Radeon HD 6670 or better  2014 Paradox Interactive  MAGICKA  is a registered trademark of Paradox Interactive AB. All rights reserved."""
221,821,2,Game,Graphic Intensive,MudRunner,the game MudRunner is the ultimate off-road experience putting the players in the driver seat and daring them to take charge of incredible all-terrain vehicles venturing across extreme Siberian landscapes with only a map and compass as guides! Drive 19 powerful all-terrain vehicles each with its own characteristics and attachable equipment. Complete your objectives and deliveries by enduring perilous conditions across wild untamed landscapes in extreme conditions with dynamic day-night cycles. Explore an immersive sandbox environment enhanced by improved graphics. Overcome muddy terrain raging rivers and other obstacles that all realistically react to the weight and movement of your vehicle powered by the game's advanced physics engine. With your map compass winch and your driving skills as allies go solo or join up to three others in the coop multiplayer. Download mods created by the passionate community for truck-loads of content and an ever-evolving MudRunner experience. Key Features The ultimate off-road experience A wider selection of 19 incredible all-terrain vehicles Explore immense untamed Siberian sandbox environments Overhauled graphics and advanced physics engine for extreme realism Complete perilous objectives and deliveries in extreme conditions Play solo or in multiplayer coop up to 4! Download mods for an ever-evolving experience System Requirements Windows - Minimum OS: Windows Vista/7/8/10 (32/64bits) PROCESSOR: Intel  Pentium Dual Core 2.0GHz or equivalent RAM MEMORY: 2 GB GRAPHICS CARD: NVIDIA GeForce 9600 GT or equivalent DVD-ROM: 2X DRIVE HARD DISK SPACE: 1 GB INTERNET CONNECTION REQUIRED FOR GAME ACTIVATION AND ONLINE GAME Windows - Recommended OS: Windows Vista/7/8/10 (32/64bits) PROCESSOR: Intel  Core 2 Duo 2.5GHz or equivalent RAM MEMORY: 4 GB GRAPHICS CARD: NVIDIA GeForce GTX 470 or equivalent DVD-ROM: 2X DRIVE HARD DISK SPACE: 1 GB INTERNET CONNECTION REQUIRED FOR GAME ACTIVATION AND ONLINE GAME  2017 MudRunner. A game developed by Saber Interactive and published by Focus Home Interactive. MudRunner is a trademark of Saber Interactive Inc. All rights reserved.
80,846,2,Game,Graphic Intensive,Overcooked Series,Overcooked 2: Activation key must be used on a valid Steam account. the game Overcooked returns with a brand-new helping of chaotic cooking action! Journey back to the Onion Kingdom and assemble your team of chefs in classic couch co-op or online play for up to four players. Hold onto your aprons  it's time to save the world (again!) Out of the frying pan into the fir  You've saved the world from the Ever Peckish. Now a new threat has arisen and it's time to get back in the kitchen to stave off the hunger of The Unbread! Key features ONLINE/LOCAL MULTIPLAYER MADNESS - You'll knead to work together (or against each other) to get the highest score in chaotic local and online multiplayer. FEAST YOUR EYES ON THIS - Journey across a brand new overworld map by land sea and air. Get cooking in new themes ranging from sushi restaurants magic schools mines and even alien planets! WHET YOUR APPETITE! - Travel the land cooking up a range of new recipes that are sure to cater to any tastes including sushi cakes burgers and pizzas. ROMAINE CALM! - Travel through teleporters across moving platforms and save time by throwing ingredients across dynamic kitchens that shift and evolve. Some kitchens even whisk your chefs away to new locations. system requirements Windows - Minimum OS: WIN7-64 bit Processor: Intel i5-4590 Memory: 4096 MB RAM Graphics: GeForce GTX 650 DirectX: Version 11 Storage: 3 GB available space Windows - Recommended OS: tbd Processor: tbd Graphics: tbd Sound Card: tbd Mac - Minimum OS: OSX 10.12.6 - Sierra Processor: Intel Core i5 @2.7Ghz Memory: 8 GB RAM Graphics: GeForce GT 640M 512Mb Storage: 3 GB available space SteamOS + Linux - Minimum OS: Ubuntu 16.01.01 Mint 17.3 Processor: Intel Core i5 @2.7Ghz Memory: 4096 MB RAM Graphics: GeForce 450GTS Storage: 3 GB available space Overcooked 2  2018 Ghost Town Games. Published by Team17 Digital Ltd. Developed by Team17 Digital Ltd and Ghost Town Games Ltd. Team17 is a trademark or registered trademark of Team17 Digital Limited. All other trademarks copyrights and logos are property of their respective owners.                                                                                                                                                                                                                                                                                                                                                                                                                                                                      Overcooked : Activation key must be used on a valid Steam account THE GAME Overcooked is a chaotic couch co-op cooking game for one to four players. Working as a team you and your fellow chefs must prepare cook and serve up a variety of tasty orders before the baying customers storm out in a huff. Sharpen your knives and dust off your chef's whites there isn't mushroom for error and the steaks are high in these crazy kitchens! The Onion Kingdom is in danger and only the finest cooking can save it! In Overcooked players must journey through a variety of cruel and unusual kitchens on their quest to become master chefs capable of conquering an ancient edible evil which plagues the land. Play solo or engage in classic chaotic couch co-op for up to four players in both co-operative and competitive challenge modes. You'll have to cook a range of different dishes and work together in order to become the most effective and ultimate team! KEY FEATURES A Culinary Quest - The Onion Kingdom is a rich world full of cruel and unusual kitchens for you to conquer. Take part in an epic journey and tackle an increasingly challenging and bizarre gauntlet of kitchens which will push your skills of co-operation and co-ordination to the very limits. Each level brings a new challenge for you and your team to overcome whether it's sliding around on a pirate ship moving between speeding trucks cooking on an ice floe or serving food in the bowels of a fiery underworld each level will test the mettle of even the bravest chefs. Simple Controls/Deep Challenge - Overcooked is so easy to pick up that anyone can join in the fun but finding a team who can communicate and co-ordinate their actions when the pizza hits the fan that's when only a well-oiled team of super-chefs will come out on top! Different Ways to Play - Whether indulging in deep fried local co-op or sauted single player as you play through the game you'll unlock new levels new chef characters and even competitive challenge levels which allow teams of two to engage in hard boiled head-to-head in the kitchen. However you want to play if you think you can stand the heat then get ready to enter the kitchen! SYSTEM REQUIREMENTS OS: Windows 7 (32Bit) Processor: Dual Core 2.4Ghz Memory: 2 GB DDR2 RAM Graphics: GeForce 8800 GT / AMD HD 6850 / Intel HD Graphics 4400 or above DirectX: Version 11.0 Storage: 750 MB available space Sound Card: DirectX compatible sound card Additional Notes: Gamepads Recommended Overcooked. Developed by Ghost Town Games Ltd 2016. Published by Team17 Digital Ltd. Team17 is a trademarks or registered trademarks of Team17 Digital Limited. All other trademarks copyrights and logos are property of their respective owners.
110,862,2,Game,Graphic Intensive,Prison Architect Series,the game Build and Manage A Maximum Security Prison. Build and manage a Maximum Security Prison. As the sun casts it's early morning rays on a beautiful patch of countryside the clock starts ticking. You've got to crack on and build a holding cell to detain the job  lot of maximum security prisoners that are trundling to your future prison on their yellow bus. As your workmen lay the last brick you don't have a moment to let them rest as they need to get started on the first proper cell block so you can make room for the next prisoner intake. Once they've all got a place to lay their weary heads the fun can really start. You'll need a canteen infirmary and a guard room oh and don't forget to plumb in a toilet or things will get messy but what about a workout area? Or solitary confinement cells? Or an execution chamber? Inspired by Dungeon Keeper Dwarf Fortress and Theme Hospital and with over 1 million players having spent time inside Prison Architect is the world's best lock-em-up. Story Mode Prison Architect opens with the story of Edward a man facing the electric chair for committing a crime of passion. This is followed by four additional chapters focusing on different characters and aspects of prison life. From Mafia Dons to power-crazed senators Prison Architect has them all! To bring these characters to life Introversion teamed up with award winning professional writer Chris Hastings producing an enthralling tale of corruption and human misery set against the background of the modern prison industrial complex. Escape Mode Finished your supermax? Got guard dogs roving every corridor and prisoners eating out of your hand? Now you can live the horror by firing up escape mode and play as a prisoner hell-bent on getting the hell out of dodge. Dig a tunnel go for the armory or start a riot and slip out in the chaos it's entirely up to you! Figure out how to escape from your own creation or hit the random button and load one of the 12000 prisons. System Requirements Windows - Minimum OS: XP Processor: Intel Core2 Duo 2.4Ghz or Higher / AMD 3Ghz or Higher Memory: 4 GB RAM Graphics: Nvidia 8600 / Radeon equivalent (2009 era) Hard Drive: 300 MB HD space Mac - Minimum Processor: 2009 era Macbook Pro Core2 Duo processor Memory: 4 GB RAM Hard Drive: 300 MB HD space Linux - Minimum OS: Ubuntu 14.04 or later Processor: Intel Core2 Duo 2.4Ghz or Higher / AMD 3Ghz or Higher Memory: 4 GB RAM Graphics: Nvidia 8600 / Radeon equivalent (2009 era) Hard Drive: 300 MB HD space
185,887,2,Game,Graphic Intensive,Red Dead Redemption 2 Series,NOTICE: Activation key must be used on a valid Rockstar Games Social Club account. the game Red Dead Redemption 2 the critically acclaimed open world epic from Rockstar Games and the highest rated game of the console generation now enhanced for PC with new Story Mode content visual upgrades and more. America 1899. The end of the wild west era has begun. After a robbery goes badly wrong in the western town of Blackwater Arthur Morgan and the Van der Linde gang are forced to flee. With federal agents and the best bounty hunters in the nation massing on their heels the gang must rob steal and fight their way across the rugged heartland of America in order to survive. As deepening internal divisions threaten to tear the gang apart Arthur must make a choice between his own ideals and loyalty to the gang who raised him. Key features With all new graphical and technical enhancements for deeper immersion Red Dead Redemption 2 for PC takes full advantage of the power of the PC to bring every corner of this massive rich and detailed world to life including increased draw distances; higher quality global illumination and ambient occlusion for improved day and night lighting; improved reflections and deeper higher resolution shadows at all distances; tessellated tree textures and improved grass and fur textures for added realism in every plant and animal. Red Dead Redemption 2 for PC also offers HDR support the ability to run high-end display setups with 4K resolution and beyond multi-monitor configurations widescreen configurations faster frame rates and more. Red Dead Redemption 2 for PC also includes additional Story Mode content including Bounty Hunting Missions Gang Hideouts Weapons and more; plus free access to the shared living world of Red Dead Online featuring all previously released improvements and the latest content for the complete Online experience including Frontier Pursuits and the specialist Roles of The Bounty Hunter Trader and Collector and much more. Red Dead Redemption 2 for PC is the ultimate way to experience one of the most critically acclaimed games of all time winner of over 175 Game of the Year Awards and recipient of over 250 perfect scores. system requirements Windows - Minimum OS: Windows 7 - Service Pack 1 (6.1.7601) Processor: Intel  Core  i5-2500K / AMD FX-6300 Memory: 8GB Graphics Card: Nvidia GeForce GTX 770 2GB / AMD Radeon R9 280 3GB HDD Space: 150 GB Sound Card: Direct X Compatible Windows - Recommended OS: Windows 10 - April 2018 Update (v1803) Processor: Intel  Core  i7-4770K / AMD Ryzen 5 1500X Memory: 12GB Graphics Card: Nvidia GeForce GTX 1060 6GB / AMD Radeon RX 480 4GB HDD Space: 150GB Sound Card: Direct X Compatible Installation activation and online play require Rockstar Games Launcher & log-in to Rockstar Games Social Club (varies 13+); internet required for activation online play and periodic entitlement verification; software installations required including Rockstar Games Launcher DirectX Microsoft Visual C++ 2015-2019 Redistributables (x64) Chromium Embedded Framework Rockstar Games Social Club Framework and authentication software that recognizes certain hardware attributes for entitlement digital rights management license enforcement support system and other purposes. Internet & Rockstar Games Launcher required; registration is limited to one Rockstar Games Social Club account (varies 13+) per purchase; only one PC log-in allowed per Rockstar Games Social Club account at any time; purchases are non-transferable; Rockstar Games Social Club accounts are non-transferable. Over time downloadable content and programming changes will change the system requirements for this game. Please refer to your hardware manufacturer and www.rockstargames.com/support for current compatibility information. Some system components such as mobile chipsets integrated and AGP graphics cards may be incompatible. Unlisted specifications may not be supported by publisher. Software license terms in game and at www.rockstargames.com/eula; online account terms at www.rockstargames.com/socialclub. Non-transferable access to special features such as exclusive/unlockable/downloadable/multiplayer/online & bonus content/services/functions may require single-use serial code additional fee and/or non-transferrable online account registration (varies 13+). Special features access may require internet connection may not be available to all users or at all times and may be terminated/modified/offered under different terms without notice. Violation of EULA Code of Conduct or other policies may result in restriction or termination of access to game or online account. For info customer & tech support visit www.rockstargames.com/support. This game is fictional. It may depict people places companies groups events buildings and other things that are similar to those in the real world; they are not affiliated or associated in any way with this game and such depictions are not factual. The makers/publishers/licensors of this video game do not endorse/condone/encourage any content. Unauthorized copying alteration reverse engineering decompiling transmission public performance rental pay for play or copy protection circumvention is prohibited & violates EULA. Certain limits apply to purchase use and redemption. See EULA www.rockstargames.com/eula and Terms of Service www.rockstargames.com/legal for details. Rockstar Games Inc. 2005-19. Rockstar Games Red Dead Redemption R* Redemption Red Dead Dead Eye are marks/logos/copyrights of Take-Two Interactive. Dolby and the Double-D symbols are trademarks of Dolby Laboratories. The ratings icon is a trademark of the Entertainment Software Association. All other marks and trademarks are properties of their respective owners. All rights reserved. Use of this product requires agreement to the following third party end user license agreement: http://www.take2games.com/eula/
