,app_id,Topic,Label,Sublabel,,
146,185,2,Game,Graphic Intensive,NBA2K,"NBA 2K series is a series of basketball simulation video games developed and released annually since 1999. The premise of each game in the series is to emulate the sport of basketball. NBA 2K19: Activation key must be used on a valid Steam account. the game NBA 2K celebrates 20 years of redefining what sports gaming can be from best in class graphics & gameplay to groundbreaking game modes and an immersive open-world Neighborhood. NBA 2K19 continues to push limits as it brings gaming one step closer to real-life basketball excitement and culture. System Requirements Windows - Minimum OS: Windows 7 64-bit Windows 8.1 64-bit or Windows 10 64-bit Processor: Intel  Core  i3-530 @ 2.93 GHz / AMD FX-4100 @ 3.60 GHz or better Memory: 4 GB RAM Graphics: NVIDIA  GeForce  GT 450 1GB / ATI  Radeon  HD 7770 1GB or better DirectX: Version 11 Storage: 80 GB available space Sound Card: DirectX 9.0x compatible Dual-Analog Gamepad: Recommended Additional Notes: Initial installation requires one-time internet connection for Steam authentication; software installations required (included with the game) include DirectX and Visual C++ Redistributable 2012. Windows - Recommended OS: Windows 7 64-bit Windows 8.1 64-bit or Windows 10 64-bit Processor: Intel  Core  i5-4430 @ 3 GHz / AMD FX-8370 @ 3.4 GHz or better Memory: 8 GB RAM Graphics: NVIDIA  GeForce  GTX 770 2GB / ATI  Radeon  R9 270 2GB or better DirectX: Version 11 Storage: 80 GB available space Sound Card: DirectX 9.0c compatible sound card Additional Notes: Dual-analog gamepad 2005-2018 Take-Two Interactive Software and its subsidiaries. All rights reserved. 2K the 2K logo and Take-Two Interactive Software are all trademarks and/or registered trademarks of Take-Two Interactive Software Inc. The NBA and NBA member team identifications are the intellectual property of NBA Properties Inc. and the respective NBA member teams. 2018 NBA Properties Inc. All Rights Reserved. Use of this product requires agreement to the following third party end user license agreement: https://www.take2games.com/eula/""                                                                                                                                                                                                                                                                                                                   NBA 2K18: Activation key must be used on a valid Steam account. THE GAME The highest rated* annual sports title returns with NBA 2K18 featuring unparalleled authenticity and improvements on the court. *According to 2008 - 2016 Metacritic.com The #1 rated NBA video game simulation series for the last 16 years (Metacritic) The #1 selling NBA video game simulation series for the last 10 years (NPD) Over 95 awards and nominations since the launch of PlayStation 4 & Xbox One Pre-order NBA 2K18 now to receive Early Access (4 days before standard release) bonus Virtual Currency and in-game content FEATURES RUN THE NEIGHBORHOOD The future of sports career modes has arrived allowing you to play the game the way you like. Build your career in NBA games hit the courts in The Playground Park join the Pro-Am circuit or explore the shops and venues in an all-new open neighborhood setting. Featuring new MyPLAYER upgrade and endorsement systems our biggest cast of characters to date including NBA players and so much more. The Road to 99 Get a free sneak peek at the neighborhood one week prior to the full release of NBA 2K18. Hit the Proving Ground streetball courts with your MyPLAYER and show the world what you have to offer. Available September 8 on the PS Store and Xbox Live. Prelude The overarching meta-game that rewards users for improving their MyPLAYER's overall rating regardless of which modes they choose to play. Featuring a unified badge system across Pro-Am Park and your NBA journey in MyCAREER your attributes animations and badges all combine to define your play style on your road to a 99 overall rating. Updated Create A Player Create the MyPLAYER you want whether scanning your face with the MyNBA2K18 mobile app or building something custom using our preset options. Hairstyles have been updated with numerous new options to choose from and body weight and height are more accurately represented to ensure the unique look you want for your MyPLAYER. MyTEAM Collect player cards featuring NBA legends from yesterday and today and compete in a variety of online and offline modes. Super Max Construct a salary-capped team and compete against other users of similar ability in a new season mode. With a limited salary cap to distribute among 13 players you'll have to be strategic in selecting your lineup for each round. Prizes are awarded based on your performance each round ensuring that every game matters. Pack & Playoffs An all-new draft mode that challenges you to build the best possible 5-man team from packs you'll open before each round. Compete against other users' drafted teams and advance to earn better prizes. With Pack & Playoffs it's a new lineup and a new experience every round. Schedule Challenges Play through a 30 game schedule for each of the 30 NBA teams. Earn MyTEAM points and prizes as you work your way through 900 unique challenges based on the 2017-18 NBA schedule. ELITE GAMEPLAY New Motion System The new motion system brings player control to a new level of realism. Now dribbling and off the ball movement are no longer driven by animations. This groundbreaking technology dynamically creates animations to deliver the best gameplay experience possible. You are now in complete control. Improved Shot Meter Hit shots more consistently thanks to an improved shot meter featuring multiple feedback points for more precise shot timing. GRAPHICS & PRESENTATION Improved Player Accuracy Countless hours of work have been put in to make every NBA player look and feel like their real-life counterparts down to the smallest details including scars stretch marks and even faded tattoos. The player body system has been completely redesigned to accurately match the physique of every player in the league and player faces have been rebuilt from scratch to show more details and respond more realistically to light. Laser Scanned Uniforms & Accessories Laser scanned uniforms from all 30 NBA teams accurately depict each design down to the smallest stitch. Using True Color Technology team colors have never been more pure & authentic and whites have never popped so brightly. And with the overhauled player body system uniforms fit accurately for each specific body type. To round out the complete on-court look of an NBA player users will enjoy the largest collection of scanned shoes and accessories in NBA 2K history. Special Guest Commentary The biggest roster of broadcasting talent in sports videogame history gets even bigger. Future Hall of Famers and former NBA 2K cover athletes Kobe Bryant and Kevin Garnett join the booth on a rotating basis to lend their expertise to the broadcast bringing the total number of in-game broadcasters to 13. LEGENDARY TEAMS All-Time Teams The greatest players in NBA history from all 30 teams together on All-Time franchise rosters for the very first time. Compete in Play Now to find out which franchise's All-Time Team reigns supreme or challenge all 30 All-Time Teams in MyTEAM's All-Time Domination mode. Classic Teams Play with 62 of the NBA's greatest teams from the past including 17 new additions. Pit your favorite classic roster against current NBA teams replay epic Finals matchups find out if Shaq & Kobe can compete with the great Lakers teams of the past or matchup the '97-98 Bulls against the '15-16 Warriors to settle the argument once and for all. The possibilities are endless. MyGM/MyLEAGUE MyGM: The Next Chapter For the first time in a sports game MyGM introduces a narrative-driven story-based franchise experience that maintains all of the user control and team building aspects that fans have come to love over the years. Your path will be determined by the choices you make and the answers you provide at many key points in the narrative. Make the story your own and build a winner! MyLEAGUE 2K's fan-favorite franchise mode allows users complete customization over their league. Choose the number of games and teams adjust the league settings and apply your custom setup to a single season multi-season or online experience. Or skip the regular season and jump right into to the Playoffs. True-To-Life League Structure & Rules Both MyGM and MyLEAGUE feature numerous updates to match real-life NBA rules including many from the new Collective Bargaining Agreement. Negotiate player contracts that work best for your franchise and each player including Super Max &  Bird Rights  deals for elite players Over-38 contracts for older players and two-way contracts for younger players. Manage your roster by using the Stretch Provision to minimize the Salary Cap when you waive a player or develop younger talent in the G-League or by stashing them overseas. Simply put the most detailed and authentic franchise experience on the market puts you in the hot seat as an NBA GM like never before. System Requirements Minimum OS: Windows 7 64-bit Windows 8.1 64-bit or Windows 10 64-bit Processor: Intel  Core  i3-530 @ 2.93 GHz / AMD Phenom  II X4 805 @ 2.50 GHz or better Memory: 4 GB RAM Graphics: NVIDIA  GeForce  GT 450 1GB / ATI  Radeon  HD 7770 1GB or better DirectX: Version 11 Storage: 70 GB available space Sound Card: DirectX 9.0x compatible Additional Notes: Dual-analog gamepad Additional Notes: Initial installation requires one-time internet connection for Steam authentication; software installations required (included with the game) include DirectX and Visual C++ Redistributable 2012. Recommended OS: Windows 7 64-bit Windows 8.1 64-bit or Windows 10 64-bit Processor: Intel  Core  i5-4430 @ 3 GHz / AMD FX-8370 @ 3.4 GHz or better Memory: 8 GB RAM Graphics: NVIDIA  GeForce  GTX 770 2GB / ATI  Radeon  R9 270 2GB or better DirectX: Version 11 Storage: 70 GB available space Sound Card: DirectX 9.0c compatible sound card Additional Notes: Dual-analog gamepad 2005-2017 Take-Two Interactive Software and its subsidiaries. All rights reserved. 2K the 2K logo and Take-Two Interactive Software are all trademarks and/or registered trademarks of Take-Two Interactive Software Inc. The NBA and NBA member team identifications are the intellectual property of NBA Properties Inc. and the respective NBA member teams. 2017 NBA Properties Inc. All Rights Reserved. Use of this product requires agreement to the following third party end user license agreement: http://www.take2games.com/eula/                                                                                                                                           NBA 2K20: Activation key must be used on a valid Steam account. Requires internet connection.About the gameNBA 2K has evolved into much more than a basketball simulation. 2K continues to redefine what's possible in sports gaming with NBA 2K20 featuring best in class graphics & gameplay ground breaking game modes and unparalleled player control and customization. Plus with its immersive open-world Neighborhood NBA 2K20 is a platform for gamers and ballers to come together and create what's next in basketball culture.System Requirements Windows - MinimumOS: Windows 7 64-bit Windows 8.1 64-bit or Windows 10 64-bitProcessor: Intel  Core  i3-530 @ 2.93 GHz / AMD FX-4100 @ 3.60 GHz or betterMemory: 4 GB RAMGraphics: NVIDIA  GeForce  GT 450 1GB / AMD  Radeon  HD 7770 1GB or betterDirectX: Version 11Storage: 80 GB available spaceSound Card: DirectX 9.0x compatible Dual-Analog Gamepad: RecommendedAdditional Notes: Initial installation requires one-time internet connection for Steam authentication; software installations required (included with the game) include DirectX and Visual C++ Redistributable 2012.Windows - RecommendedOS: Windows 7 64-bit Windows 8.1 64-bit or Windows 10 64-bitProcessor: Intel  Core  i5-4430 @ 3 GHz / AMD FX-8370 @ 3.4 GHz or betterMemory: 8 GB RAMGraphics: NVIDIA  GeForce  GTX 770 2GB / AMD  Radeon  R9 270 2GB or betterDirectX: Version 11Storage: 80 GB available spaceSound Card: DirectX 9.0c compatible sound cardAdditional Notes: Dual-analog gamepa 2005-2019 Take-Two Interactive Software Inc. and its subsidiaries. 2K the 2K logo and Take-Two Interactive Software are all trademarks and/or registered trademarks of Take-Two Interactive Software Inc. The NBA and NBA member team identifications are the intellectual property of NBA Properties Inc. and the respective NBA member teams. 2018 NBA Properties Inc. Officially licensed product of the National Basketball Players Association. All other trademarks are property of their respective owners. All rights reserved.Use of this product requires agreement to the following third party end user license agreement: http://www.take2games.com/eula/"
119,186,17,Game,Simulation,Euro Truck Simulator,Truck Simulator is a vehicle simulation game series created by SCS Software. The first title in the series
147,187,7,Browser,Browser,FacebookGameroom,Facebook Gameroom?(formerly known as?Facebook?Games Arcade) is an independent app that allows users to play?Facebook?games without accessing the?Facebook?site through a web browser.
95,189,0,Game,General,Fortnite,Fortnite is an online video game first released in 2017 and developed by Epic Games. It is available as separate software packages having different game modes that otherwise share the same general gameplay and game engine.
96,190,17,Game,Simulation,ACOrigins,Assassin's Creed Origins is an action-adventure video game developed by Ubisoft Montreal and published by Ubisoft. It is the tenth major installment in the Assassin's Creed series and the successor to 2015's Assassin's Creed Syndicate.
257,195,19,Game,RPG,BlackDesert,Black Desert Online is a sandbox-oriented massively multiplayer online role-playing game by Korean video game developer Pearl Abyss. The game has been in development since 2010
258,197,10,Game,Shooting,codoMP,Call of Duty is a first-person shooter video game franchise. The series began on Microsoft Windows
76,198,10,Game,Shooting,CrossFire,CrossFire is an online tactical first-person shooter for Microsoft Windows developed by Smilegate Entertainment. The game was released in China by Tencent Games
104,199,10,Game,Shooting,csgo,Counter-Strike: Global Offensive is a multiplayer first-person shooter video game developed by Hidden Path Entertainment and Valve Corporation.
178,201,19,Game,RPG,Diablo III,Diablo III is a dungeon crawler action role-playing game developed and published by Blizzard Entertainment.
18,202,8,Game,Platform,Discord,Discord is a proprietary freeware VoIP application and digital distribution platform designed for video gaming communities
106,203,0,Game,General,dontstarve,Don't Starve is an open world survival video game developed by the Canadian indie company Klei Entertainment. The game was initially released via Valve Corporation's Steam software for Microsoft Windows
56,204,0,Game,General,dota 2,Dota 2 is a multiplayer online battle arena video game developed and published by Valve Corporation. The game is a sequel to Defense of the Ancients
166,206,4,Open-source,Open-source,CandyCrushsaga,Candy Crush Saga is a free-to-play match-three puzzle video game released by King on April 12
45,207,8,Game,Platform,Blizzard Battle.net,Blizzard Battle.net is an Internet-based online gaming
69,208,0,Game,General,Heroes of the Storm,Heroes of the Storm is a multiplayer online battle arena video game developed and published by Blizzard Entertainment for Microsoft Windows and macOS
11,213,0,Game,General,League of Legends,League of Legends is a multiplayer online battle arena video game developed and published by Riot Games for Microsoft Windows and macOS. The game follows a freemium model and is supported by microtransactions
88,214,10,Game,Shooting,left4dead,Left 4 Dead is a series of cooperative first-person shooter
233,216,2,Game,Graphic Intensive,LootHoarder,Loot Hoarder can be obtained through Classic card packs
188,217,9,Multimedia,Audio,Mahjong,Mahjong is a tile-based game that was developed in China during the Qing dynasty and has spread throughout the world since the early 20th century. It is commonly played by four players.
274,219,4,Open-source,Open-source,MEmu App Player,MEmu is the fastest free Android Emulator to play mobile games on PC.
47,220,8,Game,Platform,Minecraft,Minecraft is a 2011 sandbox video game created by Swedish game developer Markus Persson and later developed by Mojang. The game allows players to build with a variety of different blocks in a 3D procedurally generated world
232,223,8,Game,Platform,Garena Platform ,Garena is the exclusive operator of top-tier games in Greater Southeast Asia. Through our Garena platform
14,225,2,Game,Graphic Intensive,SpeedBall,Speed ball is a 3D ball running game. In this game you can control the ball to avoid obstacles and pass levels.
30,228,2,Game,Graphic Intensive,EasyAntiCheat,Easy Anti-Cheat
237,231,10,Game,Shooting,CS,Counter-Strike is a series of multiplayer first-person shooter video games
203,233,14,Graphic,Image,Google Earth,Google Earth is a computer program that renders a 3D representation of Earth based on satellite imagery. The program maps the Earth by superimposing satellite images
170,240,17,Game,Simulation,Kindle,The Amazon Kindle is a series of e-readers designed and marketed by Amazon. Amazon Kindle devices enable users to browse
259,241,9,Multimedia,Audio,The KMPlayer,K-Multimedia Player is a media player for Windows which can play a large number of formats including VCD
245,244,6,Graphic,Video,VideoEditor,Video editing software is an application program which handles the post-production video editing of digital video sequences on a computer non-linear editing system. It has replaced traditional flatbed celluloid film editing tools and analogue video tape-to-tape online editing machines.
79,245,4,Open-source,Open-source,VLC media player,VLC media player is a free and open-source
60,247,13,Streaming,Streaming,Spotify,Spotify Ltd. is a music streaming platform developed by Swedish company Spotify Technology S.A.
113,248,14,Graphic,Image,Windows Camera,Windows Camera is an image and video capture utility included with the most recent versions of Windows and its mobile counterpart.
66,249,9,Multimedia,Audio,Windows Media Player,Windows Media Player is a media player and media library application developed by Microsoft that is used for playing audio
165,253,13,Streaming,Streaming,QQ Music,QQ Music is one of the three Chinese freemium music streaming service owned by Tencent and is under their QQ brand. As of 2018
143,254,9,Multimedia,Audio,QuickTime Player,QuickTime is an extensible multimedia framework developed by Apple Inc.
53,256,16,Productivity,Download,RealDownloader,RealDownloader is a freemium download manager by RealNetworks that downloads embedded Internet videos in multiple formats including MOV and FLV from sites such as YouTube
116,260,12,Productivity,Storage,SHAREit,SHAREit is a technology company founded in April 2015. The CEO of the company is Michael Qiu. Users can use SHAREit to transfer files including photos
150,262,9,Multimedia,Audio,PowerDVD ,CyberLink PowerDVD is a universal media player for movie discs
22,264,1,Software,Software,flash player,Adobe Flash Player is computer software for using content created on the Adobe Flash platform
275,265,4,Open-source,Open-source,Kodi,Kodi is a free and open-source media player software application developed by the XBMC Foundation
208,267,15,Productivity,Office,Power2Go,CyberLink Power2Go 8 is a cut above most of the other burning suites in this category
210,268,14,Graphic,Image,FastStone Capture,FastStone Capture is a powerful
239,270,9,Multimedia,Audio,BS Player,BSPlayer is top hardware accelerated video player for Android smartphones and tablet PCs.
187,271,15,Productivity,Office,Nero Burning ROM,Nero Burning ROM
234,277,9,Multimedia,Audio,ACGPlayer,ACG Player is a decent multimedia player with a minimalistic aspect that comes along with a wide range of interesting functions to play videos and music
279,281,14,Graphic,Image,Canon My Image Garden,My Image Garden is an application that allows you to utilize photos taken with digital cameras and other images saved on your computer
75,288,12,Productivity,Storage,bugreport,A bad bug report does not contain the information needed to reproduce and fix problems. A good bug report is an efficient form of communication for both bug reporter and bug receiver.
206,289,9,Multimedia,Audio,formatfactory,FormatFactory is an ad-supported freeware multimedia converter that can convert video
219,292,16,Productivity,Download,iTools,The best tools from across the web - Use one and switch to another tool with a click. Tools to look up
38,293,9,Multimedia,Audio,iTunes,iTunes is a media player
78,294,13,Streaming,Streaming,KuGou,KuGou is a Chinese music streaming and download service established in 2004 and owned by Tencent Music. It is the largest music streaming service in the world
39,295,12,Productivity,Storage,BitTorrent,BitTorrent is a communication protocol for peer-to-peer file sharing which is used to distribute data and electronic files over the Internet.
159,296,9,Multimedia,Audio,AIMP,AIMP is a freeware audio player for Windows and Android
120,297,13,Streaming,Streaming,Amazon Music,Amazon Music is a music streaming platform and online music store operated by Amazon.com. Launched in public beta on September 25
156,298,6,Graphic,Video,Lenovo Photo Master,From ThinkWiki. It is a tool to edit and share pictures. It is based on the CyberLink technology.
103,301,13,Streaming,Streaming,NeteaseMusic,Netease Cloud Music is a freemium music streaming service developed and owned by NetEase
133,302,9,Multimedia,Audio,NoxPlayer,Nox App Player is an Android emulator that lets you use almost any of this operating system's apps from the comfort of your own computer.
182,304,14,Graphic,Image,Photo Gallery,Photo Gallery is an image organizer
127,305,14,Graphic,Image,Picasa,Picasa is a discontinued image organizer and image viewer for organizing and editing digital photos
19,307,12,Productivity,Storage,PicaView,PicaView.dll is a DLL (Dynamic Link Library) file that belongs to ACDSee
115,308,13,Streaming,Streaming,Popcorn-Time,Popcorn Time is a multi-platform
177,309,9,Multimedia,Audio,PotPlayer,PotPlayer is a multimedia software player developed for the Microsoft Windows operating system by South Korean Internet company Kakao. The player competes against other popular media players available for the Windows operating system such as VLC media player
164,310,6,Graphic,Video,paint.net,Paint.net is a freeware raster graphics editor program for Microsoft Windows
7,314,14,Graphic,Image,Microsoft Photos,Microsoft Photos is the Microsoft's modern image viewer
246,315,12,Productivity,Storage,CyberLink MediaLibrary Service,CyberLink Media Library is an application that runs in the background if you use certain programs from CyberLink. Its main purpose is to organize and track your media files so that the main CyberLink software can work better.
260,317,14,Graphic,Image,View 3D,View 3D was a minimalist 3D object viewer that was first included in Windows 10��s Creators Update and was replaced by Mixed Reality Viewer in the Windows 10 Fall Creators Update. It supported the .fbx
64,325,1,Software,Software,nortonsecurity,Norton AntiVirus is an anti-virus and an anti-malware software developed and distributed by Symantec Corporation since 1991 as part of its Norton family of computer security products. It uses signatures and heuristics to identify viruses. Other features included in it are e-mail spam filtering and phishing protection.
201,328,4,Open-source,Open-source,CodecTweakTool,Codec Tweak Tool is a free utility able to detect and remove broken references to codecs and filters.
27,330,1,Software,Software,Kaspersky,Kaspersky Lab is a multinational cybersecurity and anti-virus provider headquartered in Moscow
262,336,1,Software,Software,QHSafeMain,QHSafeMain.exe is part of 360 Total Security and developed by QIHU 360 SOFTWARE CO.
34,337,3,Productivity,Office/Anti-virus,Windows Defender,Windows Defender is an anti-malware component of Microsoft Windows. It was first released as a downloadable free antispyware program for Windows XP
149,338,1,Software,Software,WebCompanion,Web Companion is a software program developed by Lavasoft. ... During setup
62,342,3,Productivity,Office/Anti-virus,Malwarebytes,Malwarebytes is an anti-malware software for Microsoft Windows
101,344,1,Software,Software,LogMeIn Rescue,LogMeIn Rescue is a comprehensive software that offers remote support to a wide range of platforms
70,350,3,Productivity,Office/Anti-virus,Avast Antivirus,Avast Antivirus is a family of internet security applications developed by Avast for Microsoft Windows
57,351,1,Software,Software,AVG Antivirus,AVG AntiVirus is a family of antivirus software developed by AVG Technologies
194,353,1,Software,Software,Bitdefender ,Bitdefender is a Romanian cybersecurity and anti-virus software company. It was founded in 2001 by Florin Talpe? who is currently the CEO. Bitdefender develops and sells anti-virus software
17,358,7,Browser,Browser,LINE,Line is a freeware app for instant communications on electronic devices such as smartphones
105,361,1,Software,Software,Skype,Skype is a telecommunications application software product that specializes in providing video chat and voice calls between computers
3,362,13,Streaming,Streaming,WeChat,WeChat is a Chinese multi-purpose messaging
140,363,7,Browser,Browser,Zalo,A Vietnamese IM app. Zalo is the number-one IM app in Vietnam. It works very similarly to Viber and LINE: with it
